serverguid,guid,cpuname,oscaption,osversion,cpucaption,osarchitecture,cpuarchitecture,apps,fuzzy_hash,fuzzy_hash_without_apps
ccc3b714-e9a7-11ed-84f1-005056817f5b,0275bbb3-9016-45fc-aed8-cc7dd96406d1,,Microsoft Windows 10 Pro,10.0.19042,,64-Bit,,NI-ActiveX-Container|NI-ActiveX-Container|National Instruments|NI Measurement Studio ComponentWorks UI|NI Measurement Studio ComponentWorks UI|National Instruments|NI Xerces Delay Load 2.7.6 64-bit|NI Xerces Delay Load 2.7.6 64-bit|National Instruments|NI Curl 18.0.0 (64-bit)|NI Curl 18.0.0 (64-bit)|National Instruments|NI-RPC 15.0.0f0|NI-RPC 15.0.0f0|National Instruments|NI LabVIEW 2015 SP1 f13 - Runtime|NI LabVIEW 2015 SP1 f13 - Runtime|National Instruments|NI VC2010RTE x86|NI VC2010RTE x86|National Instruments|NI-Fehlerprotokolle 2018|NI-Fehlerprotokolle 2018|National Instruments|StellarProtect|StellarProtect|TXOne|NI mDNS Responder 17.0 for Windows 64-bit|NI mDNS Responder 17.0 for Windows 64-bit|National Instruments|Intel(R) Network Connections|Intel(R) Network Connections|Intel|NI DataSocket 5.3|NI DataSocket 5.3|National Instruments|NI Authentication 2018 (64-bit)|NI Authentication 2018 (64-bit)|National Instruments|NI LabWindows/CVI 2017 Low-Level Driver (Updated)|NI LabWindows/CVI 2017 Low-Level Driver (Updated)|National Instruments|NI USI 15.0.1|NI USI 15.0.1|National Instruments|NI Security Update (KB 67L8LCQW)|NI Security Update (KB 67L8LCQW)|National Instruments|Acronis Cyber Protect|Acronis Cyber Protect|Acronis|NI DataSocket 5.3 (64 Bit)|NI DataSocket 5.3 (64 Bit)|National Instruments|NI-ActiveX-Container (64-bit)|NI-ActiveX-Container (64-bit)|National Instruments|NI-RPC 15.0.0f0 for Phar Lap ETS|NI-RPC 15.0.0f0 for Phar Lap ETS|National Instruments|NI-Webserver von Anwendungen 2018 (64 Bit)|NI-Webserver von Anwendungen 2018 (64 Bit)|National Instruments|NI VC2010RTE x64|NI VC2010RTE x64|National Instruments|NI LabWindows/CVI 9.0.1 Run-Time Engine|NI LabWindows/CVI 9.0.1 Run-Time Engine|National Instruments|NI Security Update (KB 67L8LCQW) (64-bit)|NI Security Update (KB 67L8LCQW) (64-bit)|National Instruments|NI LabVIEW 2018 Deployment Framework|NI LabVIEW 2018 Deployment Framework|National Instruments|NI System State Publisher|NI System State Publisher|National Instruments|NI MXS 15.3.0|NI MXS 15.3.0|National Instruments|NI Measurement Studio ComponentWorks 3D Graph|NI Measurement Studio ComponentWorks 3D Graph|National Instruments|NI Math Kernel Libraries|NI Math Kernel Libraries|National Instruments|NI OPCEnum Shared 64-bit|NI OPCEnum Shared 64-bit|National Instruments|NI Trace Engine (64-bit)|NI Trace Engine (64-bit)|National Instruments|NI OPCEnum Shared|NI OPCEnum Shared|National Instruments|NI LabVIEW 2015 Real-Time NBFifo|NI LabVIEW 2015 Real-Time NBFifo|National Instruments|NI Trace Engine|NI Trace Engine|National Instruments|NI Help Assistant 2.0 (64bit)|NI Help Assistant 2.0 (64bit)|National Instruments|NI Launcher|NI Launcher|National Instruments|Intel® Memory and Storage Tool|Intel® Memory and Storage Tool|Intel|Realtek High Definition Audio Driver|Realtek High Definition Audio Driver|Realtek Semiconductor Corp.|NI VC2008RTE x86|NI VC2008RTE x86|National Instruments|NI USI 15.0.1 64-bit|NI USI 15.0.1 64-bit|National Instruments|NI Microsoft Visual C++ 2015 Run-Time|NI Microsoft Visual C++ 2015 Run-Time|National Instruments|NI-Webserver von Anwendungen 2018|NI-Webserver von Anwendungen 2018|National Instruments|NI System Logging Utilities|NI System Logging Utilities|National Instruments|NI MSI Properties|NI MSI Properties|National Instruments|NI System Web Server 2018|NI System Web Server 2018|National Instruments|NI Xerces Delay Load 2.7.6|NI Xerces Delay Load 2.7.6|National Instruments|NI mDNS Responder 17.0.0|NI mDNS Responder 17.0.0|National Instruments|NI System State Publisher (64-bit)|NI System State Publisher (64-bit)|National Instruments|NI LabWindows/CVI 2017 Low-Level Driver (Original)|NI LabWindows/CVI 2017 Low-Level Driver (Original)|National Instruments|Unterstützung für NI SSL|Unterstützung für NI SSL|National Instruments|NI LabVIEW Runtime Interop 2015|NI LabVIEW Runtime Interop 2015|National Instruments|NI Service Locator 2018|NI Service Locator 2018|National Instruments|Math-Kernel-Bibliotheken (64 Bit)|Math-Kernel-Bibliotheken (64 Bit)|National Instruments|NI VC2008RTE x64|NI VC2008RTE x64|National Instruments|NI-Engine für Umgebungsvariablen 2015|NI-Engine für Umgebungsvariablen 2015|National Instruments|NI Curl 2018|NI Curl 2018|National Instruments|National Instruments Software|National Instruments Software|National Instruments|NI Error Reporting Interface 18.0 for Windows (64-bit)|NI Error Reporting Interface 18.0 for Windows (64-bit)|National Instruments|NI-Mesa|NI-Mesa|National Instruments|NI MXS 15.3.0 for 64 Bit Windows|NI MXS 15.3.0 for 64 Bit Windows|National Instruments|Unterstützung für NI SSL (64 Bit)|Unterstützung für NI SSL (64 Bit)|National Instruments|NI Uninstaller 18.0.0|NI Uninstaller 18.0.0|National Instruments|NI Logos 18.0 (64 Bit)|NI Logos 18.0 (64 Bit)|National Instruments|Math-Kernel-Bibliotheken|Math-Kernel-Bibliotheken|National Instruments|NI TDM Streaming 18.0|NI TDM Streaming 18.0|National Instruments|NI Authentication 2018|NI Authentication 2018|National Instruments|Unterstützung für nicht englische Versionen der Runtime von LabVIEW 2015 SP1.|Unterstützung für nicht englische Versionen der Runtime von LabVIEW 2015 SP1.|National Instruments|NI Help Assistant 2.0|NI Help Assistant 2.0|National Instruments|NI LabVIEW 2015 - Runtime-Engine-Webserver|NI LabVIEW 2015 - Runtime-Engine-Webserver|National Instruments|NI EulaDepot|NI EulaDepot|National Instruments|NI Logos64 XT Support|NI Logos64 XT Support|National Instruments|NI License Manager|NI License Manager|National Instruments|NI LabVIEW 2015 SP1 Deployable License|NI LabVIEW 2015 SP1 Deployable License|National Instruments|NI System Web Server Base 2018|NI System Web Server Base 2018|National Instruments|NI Logos XT Support|NI Logos XT Support|National Instruments|NI MSI Properties 64-bit|NI MSI Properties 64-bit|National Instruments|NI System Web Server Base 2018 (64-bit)|NI System Web Server Base 2018 (64-bit)|National Instruments|NI MDF Support|NI MDF Support|National Instruments|NI SSL LabVIEW RTE 2015 Support|NI SSL LabVIEW RTE 2015 Support|National Instruments|NI TDM Streaming 18.0 (64 Bit)|NI TDM Streaming 18.0 (64 Bit)|National Instruments|NI Error Reporting Interface 18.0|NI Error Reporting Interface 18.0|National Instruments|NI-RPC 15.0.0f0 for 64 Bit Windows|NI-RPC 15.0.0f0 for 64 Bit Windows|National Instruments|NI Variable Engine (64-bit)|NI Variable Engine (64-bit)|National Instruments|NI Logos 18.0|NI Logos 18.0|National Instruments|NI OPC Support|NI OPC Support|National Instruments|UltraVnc|UltraVnc|uvnc bvba|Intel(R) Network Connections 25.6.0.4|Intel(R) Network Connections 25.6.0.4|Intel,39363a574a725a664745356d776e7831704f337142425670737933314645337a466d42655039314e5869716446764d6778334d47664e3168486a5a4a61764f672f78613a4738793167574731726a4845735165,333a6b4f596a794d314b387662644c34527831696e3a576a3168704c3455
ccc3b714-e9a7-11ed-84f1-005056817f5b,03104289-f882-46ba-baa3-726632b201bc,,Microsoft Windows 7 Professional ,6.1.7601,,64-Bit,,"Adobe Flash Player 16 NPAPI|Adobe Flash Player 16 NPAPI|Adobe Systems Incorporated|Microsoft redistributable runtime DLLs VS2005 SP1(x86)|Microsoft redistributable runtime DLLs VS2005 SP1(x86)|SAP|SIMATIC NCM PC|SIMATIC NCM PC|Siemens AG|StellarProtect|StellarProtect|TXOne|SIMATIC Device Drivers|SIMATIC Device Drivers|Siemens AG|SIMATIC Runtime Manager|SIMATIC Runtime Manager|Siemens AG|Adobe Shockwave Player 12.1|Adobe Shockwave Player 12.1|Adobe Systems, Inc.|GPL Ghostscript|GPL Ghostscript|Artifex Software Inc.|IAI Corporation USB to UART Bridge Controller (Driver Removal)|IAI Corporation USB to UART Bridge Controller (Driver Removal)|IAI Corporation|SITOP DC USV 3.x.2.16|SITOP DC USV 3.x.2.16|SIEMENS A&D|Hofmann MC10 |Hofmann MC10 |Hofmann Mess- und Auswuchttechnik GmbH & Co. KG|Hofmann OPCerr |Hofmann OPCerr |Hofmann Mess- und Auswuchttechnik GmbH & Co. KG|Siemens Automation License Manager V6.0 + SP9 + Upd4|Siemens Automation License Manager V6.0 + SP9 + Upd4|Siemens AG|Microsoft redistributable runtime DLLs VS2010 SP1 (x86)|Microsoft redistributable runtime DLLs VS2010 SP1 (x86)|SAP|Java 7 Update 65|Java 7 Update 65|Oracle|Extended Asian Language font pack for Adobe Reader XI|Extended Asian Language font pack for Adobe Reader XI|Adobe Systems Incorporated|Realtek High Definition Audio Driver|Realtek High Definition Audio Driver|Realtek Semiconductor Corp.|Adobe Flash Player 16 ActiveX|Adobe Flash Player 16 ActiveX|Adobe Systems Incorporated|PC Interface Software for RC|PC Interface Software for RC|IAI Corporation|PDF24 Creator|PDF24 Creator|www.pdf24.org|SIMATIC Runtime Interfaces|SIMATIC Runtime Interfaces|Siemens AG|SIMATIC Device Drivers WoW|SIMATIC Device Drivers WoW|Siemens AG|SIMATIC SCS|SIMATIC SCS|Siemens AG|SIMATIC NCM FWL 64|SIMATIC NCM FWL 64|Siemens AG|Convert|Convert|Joshua F. Madison|Windows-Treiberpaket - FTDI Sitop UPS Driver Package (02/17/2009 2.04.16)|Windows-Treiberpaket - FTDI Sitop UPS Driver Package (02/17/2009 2.04.16)|FTDI|Microsoft redistributable runtime DLLs VS2008 SP1(x86)|Microsoft redistributable runtime DLLs VS2008 SP1(x86)|SAP AG|Adobe Reader XI (11.0.10)  MUI|Adobe Reader XI (11.0.10)  MUI|Adobe Systems Incorporated|Siemens Automation License Manager|Siemens Automation License Manager|Siemens AG|SIEMENS OPC|SIEMENS OPC|Siemens AG|SIMATIC NET CORE|SIMATIC NET CORE|Siemens AG|I+ME LevelX Driver PCI-IntelliCAN2 2.0.0.190|I+ME LevelX Driver PCI-IntelliCAN2 2.0.0.190|I+ME Actia GmbH|SIMATIC NCM PC V5.5 + SP2 + Upd1  |SIMATIC NCM PC V5.5 + SP2 + Upd1  |Siemens AG|Intel(R) Management Engine Components|Intel(R) Management Engine Components|Intel Corporation|LANDESK Advance Agent|LANDESK Advance Agent|LANDesk Software|Java 7 Update 65 (64-bit)|Java 7 Update 65 (64-bit)|Oracle|SIMATIC NET PC Software V8.2 + SP1|SIMATIC NET PC Software V8.2 + SP1|Siemens AG|UltraVnc|UltraVnc|uvnc bvba|IZArc 4.1.7|IZArc 4.1.7|Ivan Zahariev|Intel(R) Processor Graphics|Intel(R) Processor Graphics|Intel Corporation|Intel(R) Control Center|Intel(R) Control Center|Intel Corporation|Elo Touchscreen Driver 5.5.3 |Elo Touchscreen Driver 5.5.3 |Elo Touch Solutions|OPC UA SDK 1.00 Redistributables 250.8|OPC UA SDK 1.00 Redistributables 250.8|OPC Foundation|swMSM|swMSM|Adobe Systems, Inc|LANDesk(R) Common Base Agent 8|LANDesk(R) Common Base Agent 8|LANDesk Software, Ltd|SIMATIC Event Database|SIMATIC Event Database|Siemens AG|SIMOTION OPC File Manager|SIMOTION OPC File Manager|Siemens AG|VLC media player 2.0.6|VLC media player 2.0.6|VideoLAN",39363a574d516f61516f7833307a7a6139394e5166517669514551595664375a564930533a636f526f71347670665956525a4d,333a6b4f596a794d314b3650586b4c51676a3477487831696e3a576a31583030677342
ccc3b714-e9a7-11ed-84f1-005056817f5b,064c6111-31c3-4d5d-827c-9a1eb31e5066,,Microsoft Windows 7 Professional ,6.1.7601,,64-Bit,,StellarProtect|StellarProtect|TXOne|Intel(R) Processor Graphics|Intel(R) Processor Graphics|Intel Corporation|UltraVnc|UltraVnc|uvnc bvba|Trend Micro Apex One Security Agent|Trend Micro Apex One Security Agent|Trend Micro Inc.,363a576a315830306773655a4e69384e6935346d443339424a43414a4e3339424a43414a467931584f314c53354166533541463a5778334f335a6b39424a43736c39424a437369354161354146,333a6b4f596a794d314b3650586b4c51676a3477487831696e3a576a31583030677342
ccc3b714-e9a7-11ed-84f1-005056817f5b,0c6dfa17-0d5d-4ae9-8205-48ee0743295e,,Microsoft Windows 10 Enterprise 2016 LTSB,10.0.14393,,64-Bit,,NI WS Repl Library 2016|NI WS Repl Library 2016|National Instruments|Intel(R) Trusted Execution Engine Driver|Intel(R) Trusted Execution Engine Driver|Intel Corporation|NI-Mesa|NI-Mesa|National Instruments|National Instruments - Software|National Instruments - Software|National Instruments|NI MDF Support|NI MDF Support|National Instruments|NI-RPC 16.0.0f0|NI-RPC 16.0.0f0|National Instruments|NI MAX Remote Configuration 64-bit Installer 16.0|NI MAX Remote Configuration 64-bit Installer 16.0|National Instruments|NI LabWindows/CVI 2015 SP1 Network Streams Library (64-bit)|NI LabWindows/CVI 2015 SP1 Network Streams Library (64-bit)|National Instruments|NI LabWindows/CVI 2015 SP1 SxS NV Library (64-bit)|NI LabWindows/CVI 2015 SP1 SxS NV Library (64-bit)|National Instruments|NI VC2010SP1MSMs x64|NI VC2010SP1MSMs x64|National Instruments|NI LabWindows/CVI SxS Runtime 2015 SP1 f1 (64-bit)|NI LabWindows/CVI SxS Runtime 2015 SP1 f1 (64-bit)|National Instruments|NI VC2010SP1MSMs x86|NI VC2010SP1MSMs x86|National Instruments|NI LabWindows/CVI 2015 SP1 SxS TDMS Library (64-bit)|NI LabWindows/CVI 2015 SP1 SxS TDMS Library (64-bit)|National Instruments|Intel(R) Trusted Execution Engine|Intel(R) Trusted Execution Engine|Intel Corporation|NI Logos64 XT Support|NI Logos64 XT Support|National Instruments|NI Logos 5.8|NI Logos 5.8|National Instruments|NI LabWindows/CVI 2015 SP1 Network Variable Library (64-bit)|NI LabWindows/CVI 2015 SP1 Network Variable Library (64-bit)|National Instruments|NI WS Repl Library 2016 (64-bit)|NI WS Repl Library 2016 (64-bit)|National Instruments|Intel(R) Chipset Device Software|Intel(R) Chipset Device Software|Intel Corporation|NI LabWindows/CVI 2015 SP1 SxS NS Library|NI LabWindows/CVI 2015 SP1 SxS NS Library|National Instruments|NI EulaDepot|NI EulaDepot|National Instruments|NI LabWindows/CVI 2015 SP1 Analysis Library (64-bit)|NI LabWindows/CVI 2015 SP1 Analysis Library (64-bit)|National Instruments|NI LabWindows/CVI Low-Level Driver (Updated) 15.0|NI LabWindows/CVI Low-Level Driver (Updated) 15.0|National Instruments|Math Kernel Libraries (64-bit)|Math Kernel Libraries (64-bit)|National Instruments|NI-RPC 16.0.0f0 for 64 Bit Windows|NI-RPC 16.0.0f0 for 64 Bit Windows|National Instruments|NI ActiveX Container (64-bit)|NI ActiveX Container (64-bit)|National Instruments|NI LabWindows/CVI Shared Runtime 2015 SP1 f1|NI LabWindows/CVI Shared Runtime 2015 SP1 f1|National Instruments|Adobe Acrobat Reader DC - Deutsch|Adobe Acrobat Reader DC - Deutsch|Adobe Systems Incorporated|NI LabWindows/CVI Side-By-Side Runtime 2015 SP1 f1|NI LabWindows/CVI Side-By-Side Runtime 2015 SP1 f1|National Instruments|NI LabWindows/CVI Low-Level Driver (Original) 15.0|NI LabWindows/CVI Low-Level Driver (Original) 15.0|National Instruments|NI System API Windows 32-bit 16.0.0|NI System API Windows 32-bit 16.0.0|National Instruments|NI LabWindows/CVI 2015 SP1 SxS NS Library (64-bit)|NI LabWindows/CVI 2015 SP1 SxS NS Library (64-bit)|National Instruments|NI Error Reporting Interface 16.0|NI Error Reporting Interface 16.0|National Instruments|NI LabWindows/CVI 2015 SP1 Analysis Library|NI LabWindows/CVI 2015 SP1 Analysis Library|National Instruments|GPL Ghostscript|GPL Ghostscript|Artifex Software Inc.|UltraVnc|UltraVnc|uvnc bvba|NI Security Update (KB 67L8LCQW)|NI Security Update (KB 67L8LCQW)|National Instruments|NI LabWindows/CVI Shared Runtime 2015 SP1 (64-bit)|NI LabWindows/CVI Shared Runtime 2015 SP1 (64-bit)|National Instruments|NI Uninstaller|NI Uninstaller|National Instruments|NI Visual C++ 2008 Redistributable Package|NI Visual C++ 2008 Redistributable Package|National Instruments|NI ActiveX Container|NI ActiveX Container|National Instruments|NI Error Reporting Interface 16.0 for Windows (64-bit)|NI Error Reporting Interface 16.0 for Windows (64-bit)|National Instruments|NI LabWindows/CVI 2015 SP1 SxS .NET Library|NI LabWindows/CVI 2015 SP1 SxS .NET Library|National Instruments|NI LabWindows/CVI 2015 SP1 .NET Library (64-bit)|NI LabWindows/CVI 2015 SP1 .NET Library (64-bit)|National Instruments|NI LabWindows/CVI 2015 SP1 TDMS Library (64-bit)|NI LabWindows/CVI 2015 SP1 TDMS Library (64-bit)|National Instruments|NI System API Windows 64-bit 16.0.0|NI System API Windows 64-bit 16.0.0|National Instruments|NPort Administration Suite Ver1.19|NPort Administration Suite Ver1.19|Moxa Inc.|NI LabWindows/CVI 2015 SP1 SxS NV Library|NI LabWindows/CVI 2015 SP1 SxS NV Library|National Instruments|NI VC2008MSMs x64|NI VC2008MSMs x64|National Instruments|NI Visual C++ 2010 Redistributable Package|NI Visual C++ 2010 Redistributable Package|National Instruments|NI LabWindows/CVI 2015 SP1 SxS Analysis Library|NI LabWindows/CVI 2015 SP1 SxS Analysis Library|National Instruments|Microsoft Visual C++ 2015 Run-Time|Microsoft Visual C++ 2015 Run-Time|National Instruments|NI Logos 5.8 (64-bit)|NI Logos 5.8 (64-bit)|National Instruments|StellarProtect|StellarProtect|TXOne|NI Curl 16.0.0 (64-bit)|NI Curl 16.0.0 (64-bit)|National Instruments|NI Logos XT Support|NI Logos XT Support|National Instruments|NI LabWindows/CVI 2015 SP1 TDMS Library|NI LabWindows/CVI 2015 SP1 TDMS Library|National Instruments|NI LabWindows/CVI 2015 SP1 SxS .NET Library (64-bit)|NI LabWindows/CVI 2015 SP1 SxS .NET Library (64-bit)|National Instruments|Acronis Cyber Protect|Acronis Cyber Protect|Acronis|NPort Windows Driver Manager|NPort Windows Driver Manager|Moxa Inc.|NI Curl 2016|NI Curl 2016|National Instruments|NI VC2008MSMs x86|NI VC2008MSMs x86|National Instruments|NI LabWindows/CVI 2015 SP1 SxS Analysis Library (64-bit)|NI LabWindows/CVI 2015 SP1 SxS Analysis Library (64-bit)|National Instruments|NI LabWindows/CVI 2015 SP1 .NET Library|NI LabWindows/CVI 2015 SP1 .NET Library|National Instruments|NI LabWindows/CVI 2015 SP1 Network Variable Library|NI LabWindows/CVI 2015 SP1 Network Variable Library|National Instruments|NI TDM Streaming 16.0   (64-bit)|NI TDM Streaming 16.0   (64-bit)|National Instruments|Adobe Refresh Manager|Adobe Refresh Manager|Adobe Systems Incorporated|Math Kernel Libraries|Math Kernel Libraries|National Instruments|NI Security Update (KB 67L8LCQW) (64-bit)|NI Security Update (KB 67L8LCQW) (64-bit)|National Instruments|NI SSL Support|NI SSL Support|National Instruments|NI TDM Streaming 16.0|NI TDM Streaming 16.0|National Instruments|NI LabWindows/CVI Runtime (Updated) 2015 SP1|NI LabWindows/CVI Runtime (Updated) 2015 SP1|National Instruments|NI MAX Remote Configuration Installer 16.0|NI MAX Remote Configuration Installer 16.0|National Instruments|NI SSL Support (64-bit)|NI SSL Support (64-bit)|National Instruments|NI LabWindows/CVI 2015 SP1 SxS TDMS Library|NI LabWindows/CVI 2015 SP1 SxS TDMS Library|National Instruments|NI LabWindows/CVI 2015 SP1 Network Streams Library|NI LabWindows/CVI 2015 SP1 Network Streams Library|National Instruments|Intel(R) Processor Graphics|Intel(R) Processor Graphics|Intel Corporation|RedMon - Redirection Port Monitor|RedMon - Redirection Port Monitor|Ghostgum Software Pty Ltd,39363a576a4c317272726c79715a765a506657644337763576756c324e31713833706848643149344664474144314e77494f444a7659302b71706e576c78423872386c3a563834344c4f78573872387531745a6f54,333a6b4f596a794d314b38764f6d744d5741745632784662477831696e3a576a31684f434d5753677a4c
